{
  "schemaVersion": 1,
  "id": "rel_000011",
  "fromId": "evt_000116",
  "toId": "evt_000117",
  "relationType": "succeeded_by",
  "direction": "directed",
  "claim": "The armistice followed the war’s outbreak; it was not a peace treaty.",
  "citations": [
    {
      "id": "rel_000011-c1",
      "sourceId": "src_000097",
      "locator": "25 June 1950 invasion; 27 July 1953 armistice",
      "supportRole": "supports",
      "note": "Supports the factual summary and chronology. Context includes explicitly interpretive comparisons; the date note identifies limits of precision."
    },
    {
      "id": "rel_000011-c2",
      "sourceId": "src_000097",
      "locator": "25 June 1950 invasion; 27 July 1953 armistice",
      "supportRole": "supports",
      "note": "Supports the factual summary and chronology. Context includes explicitly interpretive comparisons; the date note identifies limits of precision."
    }
  ],
  "review": {
    "status": "evidence-checked",
    "authoredBy": "Codex — source-assisted research draft",
    "checkedBy": null,
    "reviewedAt": null,
    "revision": 1,
    "unresolvedIssues": [
      "Independent historical review pending; institutional-source coverage is incomplete."
    ],
    "corroboration": "An institutional source passage was inspected against the stated claim and date. Source discovery included searches for relevant institutional accounts; independent scholarly corroboration is not established. No independent reviewer has approved this record."
  }
}
