{
  "schemaVersion": 1,
  "id": "rel_000003",
  "fromId": "evt_000046",
  "toId": "evt_000047",
  "relationType": "succeeded_by",
  "direction": "directed",
  "claim": "The Timurid phase comes much later than the early settlement at Afrasiab.",
  "citations": [
    {
      "id": "rel_000003-c1",
      "sourceId": "src_000043",
      "locator": "Description and Outstanding Universal Value / Brief synthesis",
      "supportRole": "supports",
      "note": "Supports the factual summary and chronology. Context includes explicitly interpretive comparisons; the date note identifies limits of precision."
    },
    {
      "id": "rel_000003-c2",
      "sourceId": "src_000043",
      "locator": "Description and Outstanding Universal Value / Brief synthesis",
      "supportRole": "supports",
      "note": "Supports the factual summary and chronology. Context includes explicitly interpretive comparisons; the date note identifies limits of precision."
    }
  ],
  "review": {
    "status": "evidence-checked",
    "authoredBy": "Codex — source-assisted research draft",
    "checkedBy": null,
    "reviewedAt": null,
    "revision": 1,
    "unresolvedIssues": [
      "Independent historical review pending; institutional-source coverage is incomplete."
    ],
    "corroboration": "An institutional source passage was inspected against the stated claim and date. Source discovery included searches for relevant institutional accounts; independent scholarly corroboration is not established. No independent reviewer has approved this record."
  }
}
