{
  "schemaVersion": 1,
  "id": "rel_000007",
  "fromId": "evt_000084",
  "toId": "evt_000083",
  "relationType": "contributed_to",
  "direction": "directed",
  "claim": "The intensified international programme contributed to the later eradication declaration.",
  "citations": [
    {
      "id": "rel_000007-c1",
      "sourceId": "src_000072",
      "locator": "8 May 1980 declaration; intensified programme in 1967",
      "supportRole": "supports",
      "note": "Supports the factual summary and chronology. Context includes explicitly interpretive comparisons; the date note identifies limits of precision."
    },
    {
      "id": "rel_000007-c2",
      "sourceId": "src_000072",
      "locator": "8 May 1980 declaration; intensified programme in 1967",
      "supportRole": "supports",
      "note": "Supports the factual summary and chronology. Context includes explicitly interpretive comparisons; the date note identifies limits of precision."
    }
  ],
  "review": {
    "status": "evidence-checked",
    "authoredBy": "Codex — source-assisted research draft",
    "checkedBy": null,
    "reviewedAt": null,
    "revision": 1,
    "unresolvedIssues": [
      "Independent historical review pending; institutional-source coverage is incomplete."
    ],
    "corroboration": "An institutional source passage was inspected against the stated claim and date. Source discovery included searches for relevant institutional accounts; independent scholarly corroboration is not established. No independent reviewer has approved this record."
  }
}
