{
  "schemaVersion": 1,
  "id": "rel_000001",
  "fromId": "evt_000071",
  "toId": "evt_000072",
  "relationType": "succeeded_by",
  "direction": "directed",
  "claim": "Eastern Han follows Western Han after an intervening interruption; this relation does not imply continuity across the gap.",
  "citations": [
    {
      "id": "rel_000001-c1",
      "sourceId": "src_000065",
      "locator": "Western and Eastern Han chronology",
      "supportRole": "supports",
      "note": "Supports the factual summary and chronology. Context includes explicitly interpretive comparisons; the date note identifies limits of precision."
    },
    {
      "id": "rel_000001-c2",
      "sourceId": "src_000065",
      "locator": "Western and Eastern Han chronology",
      "supportRole": "supports",
      "note": "Supports the factual summary and chronology. Context includes explicitly interpretive comparisons; the date note identifies limits of precision."
    }
  ],
  "review": {
    "status": "evidence-checked",
    "authoredBy": "Codex — source-assisted research draft",
    "checkedBy": null,
    "reviewedAt": null,
    "revision": 1,
    "unresolvedIssues": [
      "Independent historical review pending; institutional-source coverage is incomplete."
    ],
    "corroboration": "An institutional source passage was inspected against the stated claim and date. Source discovery included searches for relevant institutional accounts; independent scholarly corroboration is not established. No independent reviewer has approved this record."
  }
}
